{
  "$schema": "http://json-schema.org/draft-04/schema#",
  "description": "Check-in operation",
  "type": "object",
  "properties": {
    "id": {
      "type": "string",
      "description": "Unique ID (generated UUID) of the check-in operation",
      "$ref": "raml-util/schemas/uuid.schema"
    },
    "occurredDateTime": {
      "type": "string",
      "description": "Date and time when the check-in occurred",
      "format": "date-time"
    },
    "itemId": {
      "type": "string",
      "description": "Id of item that has checked in",
      "$ref": "raml-util/schemas/uuid.schema"
    },
    "itemStatusPriorToCheckIn": {
      "type": "string",
      "description": "Item status prior to check-in"
    },
    "requestQueueSize": {
      "type": "integer",
      "description": "Request queue size for the item",
      "minimum": 0
    },
    "itemLocationId": {
      "type": "string",
      "description": "Location of the item in check-in time",
      "$ref": "raml-util/schemas/uuid.schema"
    },
    "servicePointId": {
      "type": "string",
      "description": "Service point where the item was checked in",
      "$ref": "raml-util/schemas/uuid.schema"
    },
    "performedByUserId": {
      "type": "string",
      "description": "Id of user that has performed check-in operation",
      "$ref": "raml-util/schemas/uuid.schema"
    },
    "inHouseUse": {
      "type": "boolean",
      "description": "Indicates whether the check-in was an in-house use",
      "default": false
    }
  },
  "additionalProperties": false,
  "required": [
    "occurredDateTime",
    "itemId",
    "servicePointId",
    "performedByUserId"
  ]
}
